BMI_Category,Recommended_Foods,Avoid_Foods,Caloric_Intake,Meal_Example
Underweight,"Nuts, dairy, lean meats, rice, potatoes, avocados, eggs, peanut butter, cheese, protein shakes","Sugary drinks, processed snacks, fast food, excessive caffeine, low-nutrient foods","2500-3000","Breakfast: Oatmeal with nuts & banana, Lunch: Grilled chicken with rice & veggies, Dinner: Salmon with quinoa"
Healthy Weight,"Lean proteins, whole grains, fruits, vegetables, beans, lentils, yogurt, eggs, seafood","Sugary snacks, refined carbs, excessive fried food, excessive alcohol, high-sodium processed foods","2000-2500","Breakfast: Greek yogurt with berries, Lunch: Quinoa salad with grilled fish, Dinner: Stir-fried tofu & veggies"
Overweight,"Low-carb, high-protein, fiber-rich foods, leafy greens, chicken, fish, eggs, lean beef, low-fat dairy","Processed sugar, refined grains, high-fat fast food, excessive dairy, deep-fried foods, sugary beverages","1500-2000","Breakfast: Scrambled eggs with spinach, Lunch: Grilled chicken salad, Dinner: Lentil soup with steamed veggies"
Obese,"Strict calorie deficit, lean proteins, fiber-rich foods, healthy fats, broccoli, kale, cauliflower, carrots","Sugary drinks, processed carbs, fried foods, excessive dairy, red meat, white bread, high-calorie sauces","1200-1500","Breakfast: Chia seed pudding, Lunch: Baked salmon with broccoli, Dinner: Grilled turkey with quinoa & greens"
Diabetic,"Whole grains, lean protein, legumes, leafy greens, berries, nuts, olive oil, low-fat dairy","Refined sugars, white rice, high-sodium processed foods, artificial sweeteners","1400-1800","Breakfast: Scrambled eggs with whole wheat toast, Lunch: Quinoa & black bean bowl, Dinner: Grilled fish & veggies"
Heart Health,"Omega-3 rich fish, whole grains, nuts, seeds, fruits, vegetables, low-fat dairy","High-sodium foods, processed meats, trans fats, refined sugar, fried foods","1600-2200","Breakfast: Oatmeal with flaxseeds, Lunch: Grilled salmon with quinoa, Dinner: Stir-fried tofu & greens"
